{
  "$schema": "https://json-schema.org/draft/2020-12/schema",
  "$id": "https://research-notes.561.group/hacking/library/research/operations/engineering/triage/software/relationality/schemas/system.schema.json",
  "title": "System Definition",
  "description": "System is a living subgraph of the AOG composed of typed components per README Section 5.",
  "type": "object",
  "required": [
    "id",
    "profile_topos_id",
    "phase_space_id",
    "measurement_frame_id",
    "regime_id",
    "trace_id",
    "fixed_invariants_id",
    "runbook_id",
    "trace_runbook_id"
  ],
  "properties": {
    "id": {"type": "string"},
    "profile_topos_id": {"type": "string"},
    "phase_space_id": {"type": "string"},
    "measurement_frame_id": {"type": "string"},
    "regime_id": {"type": "string"},
    "trace_id": {"type": "string"},
    "fixed_invariants_id": {"type": "string"},
    "runbook_id": {"type": "string"},
    "trace_runbook_id": {"type": "string"}
  },
  "additionalProperties": false
}
