{
  "id": "secondary",
  "profile_topos_id": "profile-topos:default",
  "phase_space_id": "phase-space:default",
  "measurement_frame_id": "measurement-frame:default",
  "regime_id": "regime:default",
  "trace_id": "trace:default",
  "fixed_invariants_id": "fixed-invariants:default",
  "runbook_id": "canonical-system-interaction",
  "trace_runbook_id": "system-trace"
}
